{
  "product_id": "0fc7b542-443e-417e-9692-5d2547e8603d",
  "product_title": "Business Command Center",
  "script": {
    "hook": "Struggling to keep your growing business organized and on track? Regain control with the all-in-one Business Command Center Notion template.",
    "intro": "If you're a business owner or entrepreneur, you know how challenging it can be to manage all the moving parts of your company - from finance and operations to sales and marketing. That's why I'm excited to introduce you to the Business Command Center, a Notion template that puts the pulse of your business at your fingertips.",
    "feature_walkthrough": [
      "The first thing you'll notice when you open the Business Command Center is the comprehensive, customizable dashboard. This is where you can centralize all of your most important business data, including your financial health, sales pipeline, and key performance indicators. With real-time visibility into these critical metrics, you'll be able to make faster, more informed decisions to drive your company forward.",
      "Next, let's take a look at the operations and task management features. The Business Command Center streamlines your workflows and boosts team productivity with integrated project management tools. You can easily assign tasks, track progress, and stay on top of deadlines, all within a single, collaborative workspace.",
      "But the true power of this template lies in its advanced analytics and reporting capabilities. You can generate in-depth reports on your financials, sales, and marketing efforts, giving you the business intelligence you need to optimize your strategies and maximize your growth potential."
    ],
    "benefits": "By using the Business Command Center Notion template, you'll gain complete control over your company's operations, make better-informed decisions, and take your business to new heights. It's the all-in-one solution you need to streamline your workflows, boost productivity, and elevate your performance.",
    "cta": "So, what are you waiting for? Get the Business Command Center Notion template today and transform the way you manage your growing business.",
    "timestamps": [
      "0:00 - Introduction",
      "0:30 - Centralized Dashboard",
      "1:15 - Operations & Task Management",
      "2:00 - Analytics & Reporting",
      "2:45 - Benefits Summary",
      "3:00 - Call to Action"
    ],
    "video_title": "Take Control of Your Business with the Notion Business Command Center",
    "video_description": "Struggling to keep your growing business organized and on track? Regain control with the all-in-one Business Command Center Notion template. Centralize your data, streamline your workflows, and make better-informed decisions to take your company to new heights. Get it now: [link to template]",
    "tags": [
      "Notion",
      "Productivity",
      "Business Management",
      "Dashboard",
      "Operations",
      "Analytics"
    ]
  },
  "metadata": {
    "snippet": {
      "title": "Take Control of Your Business with the Notion Business Command Center",
      "description": "Struggling to keep your growing business organized and on track? Regain control with the all-in-one Business Command Center Notion template. Centralize your data, streamline your workflows, and make better-informed decisions to take your company to new heights. Get it now: [link to template]\n\nüì• GET THIS TEMPLATE: https://buy.stripe.com/7sY28k51LdhufiwgeYbZe0v\n\n‚ú® What's Included:\n‚úì Centralized data hub for all your business information\n‚úì Customizable dashboard with real-time metrics and KPIs\n‚úì Comprehensive financial management tools\n‚úì Streamlined sales and marketing workflows\n‚úì Optimized operations and task management\n\nüí∞ Price: $45\nüîó Website: https://modernbusinessmum.com\n\n‚è±Ô∏è TIMESTAMPS:\n0:00 - Introduction\n0:30 - Centralized Dashboard\n1:15 - Operations & Task Management\n2:00 - Analytics & Reporting\n2:45 - Benefits Summary\n3:00 - Call to Action\n\n---\n\n#NotionTemplate #Productivity #Business #Organization #DigitalPlanner\n\nü§ñ This video was created with AI automation to help you discover the best Notion templates for your needs.",
      "tags": [
        "Notion",
        "Productivity",
        "Business Management",
        "Dashboard",
        "Operations",
        "Analytics"
      ],
      "categoryId": "28",
      "defaultLanguage": "en",
      "defaultAudioLanguage": "en"
    },
    "status": {
      "privacyStatus": "public",
      "selfDeclaredMadeForKids": false
    }
  },
  "buy_link": "https://buy.stripe.com/7sY28k51LdhufiwgeYbZe0v",
  "created_at": "2025-11-27T17:03:26.519Z"
}