{
  "product_id": "86556de2-e949-41bd-bc84-4325674b484a",
  "product_title": "Ambitious OKR Tracker",
  "script": {
    "hook": "Are your business goals feeling more and more out of reach? Struggle no more, my friend - I've got the solution that's about to transform the way you set and achieve your most ambitious objectives.",
    "intro": "As a driven business leader, you know that setting and achieving ambitious goals is key to driving growth and success. But the reality is, most goal-setting frameworks fall short, leaving you feeling frustrated and stuck. That's why I'm excited to introduce you to the Ambitious OKR Tracker - a transformative Notion template that empowers you to effortlessly define, track, and optimize your Objectives and Key Results (OKRs).",
    "feature_walkthrough": [
      "First up, let's talk about clarity and alignment. With the Ambitious OKR Tracker, you and your team can easily align around a shared vision and stay laser-focused on what truly matters. Gone are the days of disjointed, siloed goals - this template gives you a collaborative workspace to define and review your OKRs together.",
      "Next, accountability. Leveraging the real-time progress tracking and scoring system, you can ensure that everyone is contributing to your goals. No more wondering who's pulling their weight - the Ambitious OKR Tracker keeps everyone accountable and on track.",
      "And finally, let's talk about decision-making. With the powerful reporting and analytics tools built into this template, you'll gain deep insights into your performance. You'll be able to make informed, data-driven decisions to optimize your strategy and achieve your most ambitious goals."
    ],
    "benefits": "Ultimately, the Ambitious OKR Tracker is your gateway to unlocking unprecedented levels of productivity and performance. With this transformative Notion solution, you'll enjoy crystal-clear clarity, increased accountability, and improved decision-making - all the ingredients you need to take your business to new heights.",
    "cta": "Don't let another quarter go by without a clear roadmap to success. Claim your copy of the Ambitious OKR Tracker today and start achieving your most ambitious goals.",
    "timestamps": [
      "0:00 - Introduction",
      "0:30 - Clarity and Alignment",
      "1:15 - Increased Accountability",
      "2:00 - Improved Decision-Making",
      "2:45 - Benefits Summary",
      "3:15 - Call to Action"
    ],
    "video_title": "Unlock the Power of OKRs with the Ambitious OKR Tracker for Notion",
    "video_description": "Struggling to Achieve Your Ambitious Business Goals? Unlock the Power of OKRs with Our Comprehensive Notion Template. Claim your copy of the Ambitious OKR Tracker today: [link]",
    "tags": [
      "notion templates",
      "okr tracker",
      "goal setting",
      "productivity",
      "business growth"
    ]
  },
  "metadata": {
    "snippet": {
      "title": "Unlock the Power of OKRs with the Ambitious OKR Tracker for Notion",
      "description": "Struggling to Achieve Your Ambitious Business Goals? Unlock the Power of OKRs with Our Comprehensive Notion Template. Claim your copy of the Ambitious OKR Tracker today: [link]\n\nüì• GET THIS TEMPLATE: https://buy.stripe.com/bJe7sEdyh6T66M0e6QbZe0Y\n\n‚ú® What's Included:\n‚úì Intuitive goal-setting framework based on Objectives and Key Results (OKRs)\n‚úì Collaborative workspace for teams to define, track, and review OKRs\n‚úì Customizable OKR templates and pre-built workflows to streamline the process\n‚úì Real-time progress monitoring and scoring system for key results\n‚úì Powerful reporting and analytics tools to measure and optimize performance\n\nüí∞ Price: $25\nüîó Website: https://modernbusinessmum.com\n\n‚è±Ô∏è TIMESTAMPS:\n0:00 - Introduction\n0:30 - Clarity and Alignment\n1:15 - Increased Accountability\n2:00 - Improved Decision-Making\n2:45 - Benefits Summary\n3:15 - Call to Action\n\n---\n\n#NotionTemplate #Productivity #Business #Organization #DigitalPlanner\n\nü§ñ This video was created with AI automation to help you discover the best Notion templates for your needs.",
      "tags": [
        "notion templates",
        "okr tracker",
        "goal setting",
        "productivity",
        "business growth"
      ],
      "categoryId": "28",
      "defaultLanguage": "en",
      "defaultAudioLanguage": "en"
    },
    "status": {
      "privacyStatus": "public",
      "selfDeclaredMadeForKids": false
    }
  },
  "buy_link": "https://buy.stripe.com/bJe7sEdyh6T66M0e6QbZe0Y",
  "created_at": "2025-11-27T19:12:25.412Z"
}